{
  "schema": "pneuma.source.document-library/v1",
  "provider": "mock",
  "library_id": "relayforge-vault-b02",
  "title": "RelayForge Vault · B02",
  "documents": [
    {
      "document_id": "doc-b02-decision",
      "path": "01-Projects/RelayForge/Weeks/B02-客户访谈.md",
      "title": "客户访谈周决定与证据",
      "content": "# 客户访谈周决定与证据\n\n> [!summary] 本周目标\n> 从访谈中识别最痛的可验证工作，而不是收集功能愿望\n\n## 已确认事实\n\n- 五名访谈对象都能找到会议纪要，但四人无法快速定位决定的原始证据。\n- 北辰咨询每周约有六场客户会议，项目频道消息量远高于邮件。\n- 客户愿意为减少验收争议付费，而不是为更长的摘要付费。\n\n## 决定变化\n\n- 旧设想（已失效）：把实时转写和会议摘要作为首页唯一入口。\n- 当前决定：把跨来源决定、承诺和引用回放作为 MVP 的核心路径。\n- 执行护栏：对没有来源支撑的回答必须明确显示证据不足。\n\n## 承诺\n\n- [ ] 沈砚在周三前交付一张跨来源证据流程图。\n- [ ] 唐恬在周五前给出十个真实但脱敏的验收问题。\n\n## 约束\n\n- 一次检索结果必须在三秒内先给出可读反馈。\n- 引用必须落到稳定 source id 和块区间，不能只链接摘要。\n\n## 证据导航\n\n- 会议：[[02-Meetings/B02-客户访谈走查]]\n- 客户：[[01-Projects/RelayForge/Customers/北辰咨询]]\n\n## 工作过程\n\n午后重新打开这条记录时，先把能直接回到原文的句子列出来，再将推断放到单独小节。正文没有增加新范围，只修正了一个容易误读的表达。没有新的书面确认前，现状保持不变。\n\n从会议逐字稿回到文档后，同一个结论在会议、消息和邮件中出现时，保留各自时间与语气差异。旧版本没有被覆盖，而是作为已经失效的想法继续可回放。即使它再次出现，也不会因为重复而增加证据强度。\n\n2026-03-09早上清理收件箱时，没有明确确认的事项继续留在待验证区，不把重复出现当作事实。旧版本没有被覆盖，而是作为已经失效的想法继续可回放。即使它再次出现，也不会因为重复而增加证据强度。\n\n晚间复盘注意力切换时，周末复盘只改变优先级，不回写或美化原始来源。旧版本没有被覆盖，而是作为已经失效的想法继续可回放。等真正进入排期时，再补验收条件和退出标准。\n\n本周第二次整理这个主题时，先把能直接回到原文的句子列出来，再将推断放到单独小节。我把口头意见和可验收条件拆开，避免两者在摘要里粘连。我把它留给未来的自己，而不是当作已经完成的工作。\n\n为准备客户访谈阶段的下一次走查，同一个结论在会议、消息和邮件中出现时，保留各自时间与语气差异。当前能确认的是处理动作，不是客户已经接受结果。即使它再次出现，也不会因为重复而增加证据强度。\n\n准备把草稿移入归档前，没有明确确认的事项继续留在待验证区，不把重复出现当作事实。正文没有增加新范围，只修正了一个容易误读的表达。等真正进入排期时，再补验收条件和退出标准。\n\n2026-03-09早上清理收件箱时，周末复盘只改变优先级，不回写或美化原始来源。这条内容先进入待核对区，等会后邮件给出明确状态。这次整理的目的只是恢复上下文，不是增加材料体量。\n\n在关闭编辑器之前，先把能直接回到原文的句子列出来，再将推断放到单独小节。正文没有增加新范围，只修正了一个容易误读的表达。后续若引用它，应同时带上来源位置和发生时间。\n\n为准备客户访谈阶段的下一次走查，同一个结论在会议、消息和邮件中出现时，保留各自时间与语气差异。旧版本没有被覆盖，而是作为已经失效的想法继续可回放。即使它再次出现，也不会因为重复而增加证据强度。",
      "frontmatter": {
        "title": "客户访谈周决定与证据",
        "created": "2026-03-11T17:30:00+08:00",
        "status": "current",
        "week": 2,
        "synthetic": true
      },
      "tags": [
        "relayforge",
        "decision",
        "week-02"
      ],
      "links": [
        {
          "target": "01-Projects/RelayForge/Weeks/B01",
          "label": "上周",
          "embedded": false
        }
      ],
      "created_at": "2026-03-11T17:30:00+08:00",
      "modified_at": "2026-03-11T20:30:00+08:00",
      "metadata": {
        "batch_id": "B02"
      }
    },
    {
      "document_id": "doc-b02-clip",
      "path": "00-Inbox/Clippings/B02-未整理剪藏.md",
      "title": "未整理剪藏 · 客户访谈",
      "content": "# 未整理剪藏 · 客户访谈\n\ntags: #read-later #unverified\n\n午后重新打开这条记录时，有人说所有 B2B 产品都应该先做团队权限，但这篇帖子没有数据来源。这个案例可能值得访谈追问，目前还不能改变优先级。下一次处理必须先回到原文，而不是沿用这次印象。\n\n从会议逐字稿回到文档后，收藏了一篇增长文章，只看了标题；里面的漏斗数字不适用于当前客户。作者省略了实施成本，因此这里继续标为未核验。没有新的书面确认前，现状保持不变。\n\n对照上一版决定记录时，所有访谈对象都强烈要求语音克隆。作者省略了实施成本，因此这里继续标为未核验。没有新的书面确认前，现状保持不变。\n\n在关闭编辑器之前，一段关于品牌命名的讨论很热闹，但没有任何设计合作客户参与。它触发了一个问题，但没有给出可直接采用的答案。后续若引用它，应同时带上来源位置和发生时间。\n\n午后重新打开这条记录时，把三个可能的首页文案放在这里，顺序随机，暂时不选。这个案例可能值得访谈追问，目前还不能改变优先级。后续若引用它，应同时带上来源位置和发生时间。\n\n从会议逐字稿回到文档后，外部案例声称一天获得上千注册，未核验渠道、预算或转化定义。原链接仍在待读区，标题和转述都不能充当证据。我把它留给未来的自己，而不是当作已经完成的工作。\n\n午后重新打开这条记录时，有人说所有 B2B 产品都应该先做团队权限，但这篇帖子没有数据来源。评论区很热闹，正文却没有能复核的数据口径。等真正进入排期时，再补验收条件和退出标准。\n\n在关闭编辑器之前，收藏了一篇增长文章，只看了标题；里面的漏斗数字不适用于当前客户。评论区很热闹，正文却没有能复核的数据口径。后续若引用它，应同时带上来源位置和发生时间。\n\n对照上一版决定记录时，所有访谈对象都强烈要求语音克隆。它看起来与当前产品相近，但样本、预算和客户类型都不同。后续若引用它，应同时带上来源位置和发生时间。\n\n在关闭编辑器之前，一段关于品牌命名的讨论很热闹，但没有任何设计合作客户参与。我只记录了为什么收藏，没有把文章观点并入路线图。这条记录到此结束，不自动生成后续任务。\n\n本周第二次整理这个主题时，把三个可能的首页文案放在这里，顺序随机，暂时不选。评论区很热闹，正文却没有能复核的数据口径。等真正进入排期时，再补验收条件和退出标准。\n\n把工作和个人收件箱分开以后，外部案例声称一天获得上千注册，未核验渠道、预算或转化定义。评论区很热闹，正文却没有能复核的数据口径。下一次处理必须先回到原文，而不是沿用这次印象。\n\n为准备客户访谈阶段的下一次走查，有人说所有 B2B 产品都应该先做团队权限，但这篇帖子没有数据来源。这个案例可能值得访谈追问，目前还不能改变优先级。没有新的书面确认前，现状保持不变。\n\n本周第二次整理这个主题时，收藏了一篇增长文章，只看了标题；里面的漏斗数字不适用于当前客户。先保留出处；若后续没有客户材料支持，就在周末清理掉。周末只决定是否继续关注，不改写它当时的不确定性。\n\n午后重新打开这条记录时，所有访谈对象都强烈要求语音克隆。这个案例可能值得访谈追问，目前还不能改变优先级。这次整理的目的只是恢复上下文，不是增加材料体量。\n\n为准备客户访谈阶段的下一次走查，一段关于品牌命名的讨论很热闹，但没有任何设计合作客户参与。原链接仍在待读区，标题和转述都不能充当证据。后续若引用它，应同时带上来源位置和发生时间。",
      "frontmatter": {
        "title": "未整理剪藏 · 客户访谈",
        "created": "2026-03-11T10:30:00+08:00",
        "status": "unprocessed",
        "week": 2,
        "synthetic": true
      },
      "tags": [
        "read-later",
        "unverified"
      ],
      "links": [
        {
          "target": "01-Projects/RelayForge/Weeks/B01",
          "label": "上周",
          "embedded": false
        }
      ],
      "created_at": "2026-03-11T10:30:00+08:00",
      "modified_at": "2026-03-11T13:30:00+08:00",
      "metadata": {
        "batch_id": "B02"
      }
    },
    {
      "document_id": "doc-b02-daily",
      "path": "03-Daily/2026-03-09.md",
      "title": "2026-03-09 日记",
      "content": "# 2026-03-09 日记\n\n## Inbox\n\n- [ ] 首页背景可以换成紫色渐变。\n- [ ] 回一个不紧急的社区私信\n- [x] 把昨天的临时截图移到归档\n- [ ] 检查咖啡机滤芯，和产品没有关系\n- [ ] 先买一台新的机械键盘再继续开发。\n\n## 随手记\n\n从北辰咨询最近提供的材料回看，上午切换了太多窗口，几次忘记刚才为什么打开日志。今天的产出很小，但至少没有制造未经确认的承诺。我把它留给未来的自己，而不是当作已经完成的工作。\n\n晚间复盘注意力切换时，想到一个功能名字又觉得太像别的产品，先不做任何设计。情绪和疲劳影响了节奏，所以没有在晚上做范围判断。周末只决定是否继续关注，不改写它当时的不确定性。\n\n准备把草稿移入归档前，社区里有人推荐另一套技术栈，看起来有趣，但迁移成本完全没算。这件事更像生活维护，不需要进入产品知识。即使它再次出现，也不会因为重复而增加证据强度。\n\n在关闭编辑器之前，晚上状态一般，只修了两个小错误，没有形成需要长期保存的结论。这件事更像生活维护，不需要进入产品知识。这条记录到此结束，不自动生成后续任务。\n\n准备把草稿移入归档前，上午切换了太多窗口，几次忘记刚才为什么打开日志。我关掉通知后继续工作，没有把忙碌误写成进展。后续若引用它，应同时带上来源位置和发生时间。\n\n本周第二次整理这个主题时，想到一个功能名字又觉得太像别的产品，先不做任何设计。情绪和疲劳影响了节奏，所以没有在晚上做范围判断。后续若引用它，应同时带上来源位置和发生时间。\n\n为准备客户访谈阶段的下一次走查，社区里有人推荐另一套技术栈，看起来有趣，但迁移成本完全没算。情绪和疲劳影响了节奏，所以没有在晚上做范围判断。周末只决定是否继续关注，不改写它当时的不确定性。\n\n把工作和个人收件箱分开以后，晚上状态一般，只修了两个小错误，没有形成需要长期保存的结论。它没有改变今天的主任务，只造成了几次注意力切换。这次整理的目的只是恢复上下文，不是增加材料体量。\n\n2026-03-09早上清理收件箱时，上午切换了太多窗口，几次忘记刚才为什么打开日志。临时想法先经过一晚，第二天仍重要再进入项目文档。我把它留给未来的自己，而不是当作已经完成的工作。\n\n晚间复盘注意力切换时，想到一个功能名字又觉得太像别的产品，先不做任何设计。它没有改变今天的主任务，只造成了几次注意力切换。下一次处理必须先回到原文，而不是沿用这次印象。\n\n午后重新打开这条记录时，社区里有人推荐另一套技术栈，看起来有趣，但迁移成本完全没算。情绪和疲劳影响了节奏，所以没有在晚上做范围判断。这条记录到此结束，不自动生成后续任务。\n\n从会议逐字稿回到文档后，晚上状态一般，只修了两个小错误，没有形成需要长期保存的结论。我当时只记了一句话，晚些时候也没有形成新的决定。周末只决定是否继续关注，不改写它当时的不确定性。",
      "frontmatter": {
        "title": "2026-03-09 日记",
        "created": "2026-03-14T20:30:00+08:00",
        "status": "unprocessed",
        "week": 2,
        "synthetic": true
      },
      "tags": [
        "daily",
        "inbox"
      ],
      "links": [
        {
          "target": "01-Projects/RelayForge/Weeks/B01",
          "label": "上周",
          "embedded": false
        }
      ],
      "created_at": "2026-03-14T20:30:00+08:00",
      "modified_at": "2026-03-14T23:30:00+08:00",
      "metadata": {
        "batch_id": "B02"
      }
    }
  ],
  "metadata": {
    "batch_id": "B02",
    "note_count": 3
  }
}
